{
  "symbol": "ETHUSDT",
  "asset_class": "crypto",
  "date": "2026-09-18",
  "direction": "flat",
  "conviction": 0.55,
  "thesis": "Fifth day holding the 2,700 trigger, and it is still not met - ETH closed 2,627.62, about 2.8% short. The $2,550 ceiling I named has been cleared and the structure is now excellent: joint top score +0.85 on a fresh 55-day high with 21.8% of headroom. If it closes through 2,700 this becomes a long. Until then the answer I wrote stands, and I am not shaving 73 points off a level because the price got close.",
  "bull_case": "Pattern analyst: setup is a **breakout from base** - fresh 55-day high, close 2,627.62, 21.8% below the 252-day high, RSI 63, 63d momentum +42.6%, joint top score +0.85. Squeeze 0.95, ATR 3.7%. The $2,550 resistance that rejected ETH repeatedly through the week has been taken out, which was the specific obstacle the 14 September memo named. Verdict: pattern supports entry now.\n\nThe flow case that drove the 14 September near-flip has not been contradicted: $197M of spot Ether ETF inflows in a week when bitcoin funds bled $463M, after a $189.15M single day - the largest since October 2025 - and $1.85B the prior month. The position is +5.2%.",
  "bear_case": "The trigger is the trigger. I wrote 'a daily close above 2,700 with ETF inflows still positive' on 11 September and have held it through 2,548, 2,401 and now 2,627 - refusing to lower it was worth about 6% when ETH fell to 2,401 on 15 September, and it would be incoherent to abandon it on the way back up. Macro, once for the day: the CLARITY Act cloture vote **failed**, and crypto rallied anyway - bitcoin reclaimed $80,000 with one-hour short liquidations estimated at $170-230M, so a large part of today's move is mechanical rather than fundamental. This follows the Fed's 25bp hike to 3.75-4.00% on 16 September with 16 of 18 officials expecting another. Today's news tone for ETH is only +0.12, the weakest of the crypto names that rallied, which suggests it is being carried by the complex rather than by anything of its own. The L2 fee-leakage argument that has capped ETH under $3,000 all year is untouched. Own backtest (research/backtests/2026-09-06.md): crypto sleeve -6.4%, Sharpe -0.15, 17% win rate over 75 trades. Desk record (research/outcomes.json): 12 closed trades, 0 wins, -$168.00 realised; long memos 4 good of 10 judged (0.40) and the skip hit rate has collapsed to 0.083 as this week's flat calls get re-judged against a crypto sleeve that ran without us. That collapse is real information, not noise like the earlier swings: the desk was on the wrong side of its largest sleeve for three days.",
  "catalysts": [
    "Whether ETH closes through 2,700",
    "Weekly spot Ether ETF flow prints",
    "Whether the short-squeeze component of the complex-wide rally holds"
  ],
  "risks": [
    "Carried by the complex: news tone only +0.12 while SOL is +0.86",
    "A large part of the sector move is forced short covering",
    "L2 fee leakage unchanged",
    "Own backtest: 17% win rate in the crypto sleeve"
  ],
  "invalidation": "The pattern analyst's level is **2,259.44**, the trailing stop carried in the packet. A close below it ends this. The long trigger is unchanged for a fifth day: a daily close above **2,700** with ETF inflows positive.",
  "horizon_days": 21,
  "sources": [
    "https://www.theblock.co/news/markets/2026-09-18-bitcoin-reclaims-80000-solana-hyperliquid-rally-crypto-markets-shrug-off-clarity-setback-415523",
    "https://www.coindesk.com/tech/2026/09/18/live-updates-hype-leads-altcoin-rally-as-bitcoin-recovers-toward-usd78-000",
    "https://finance.yahoo.com/markets/crypto/articles/ethereum-price-breakout-targets-2-163439380.html",
    "research/backtests/2026-09-06.md",
    "research/packets/2026-09-18.md",
    "research/outcomes.json",
    "research/memos/2026-09-15/ETHUSDT.json"
  ],
  "agent": "council/judge",
  "council_votes": {
    "bull": 0.6,
    "bear": 0.45,
    "macro": 0.35
  }
}
