{
  "symbol": "LINKUSDT",
  "asset_class": "crypto",
  "date": "2026-09-07",
  "direction": "flat",
  "conviction": 0.55,
  "thesis": "Revised this evening, against this morning's long call. The adoption story got better during the day - DTCC's collateral platform is targeting a Q4 commercial launch and Chainlink prices tokenised stocks on Coinbase - but the positioning data got worse: the whale I flagged has now sent 2.41M LINK (~$26.04M) to Coinbase over three weeks, not the single $7.6M transfer, and every wallet cohort has moved into net distribution for the first time since early June. Daily RSI14 near 76 with price above the upper Bollinger band is not a level to own more at. Hold the position and let the trailing stop work; adding here has no edge.",
  "bull_case": "The integration list keeps lengthening with named, dated counterparties: Bottomline bringing CCIP and CRE to 600+ banks handling over $16T in annual payments (4 Sep 2026); Circle's wrapped bitcoin using Chainlink Proof of Reserve (6 Sep 2026); Chainlink Data Feeds live on Tempo (4 Sep 2026); DTCC's collateral platform targeting a Q4 2026 commercial launch; Chainlink pricing tokenised stocks on Coinbase; Schwab adding LINK in coming months. LINK-linked spot ETF products logged four straight weeks of net inflows through 24 Aug 2026, cumulative past $145M. External quotes have LINK around $13.07-13.32 and up ~7.1% on the session, and the daily trend is unambiguously up. The position is well in profit from 12.24.",
  "bear_case": "The distribution is bigger and broader than this morning's memo assumed. The whale has sent 2.41M LINK (~$26.04M) to Coinbase over three weeks - sustained, not a one-off - and on-chain work reports every wallet cohort shifting into net distribution for the first time since early June. That is the supply side of a rally being handed to late buyers. Momentum is stretched past the packet's reading: external daily RSI14 near 76 against the packet's 69, with price above the upper Bollinger band at $12.96, a configuration that historically invites a pause at best. Sector flows still favour bitcoin over alts - inflows into ETH, SOL, XRP and Hyperliquid products fell 73-96% in the week ending 4 Sep while bitcoin funds took $986.9M - and the whole crypto market was down 0.73% on Monday with the weekend's altcoin gains stalling. Base rate from our own backtest (research/backtests/2026-09-06.md): the crypto sleeve returned -6.4% with Sharpe -0.15 and a 17% win rate over 75 trades. Nothing in this asset's fundamentals fixes a 17% win rate on entries taken at RSI 76.",
  "catalysts": [
    "DTCC collateral platform commercial launch targeted for Q4 2026",
    "Schwab adding LINK trading to its crypto platform",
    "Bottomline/CCIP bank rollout milestones after the 4 Sep 2026 announcement",
    "Continued CLNK/LINK ETF net inflows (cumulative past $145M as of 24 Aug 2026)"
  ],
  "risks": [
    "Sustained whale distribution: 2.41M LINK (~$26.04M) to Coinbase over three weeks",
    "All wallet cohorts in net distribution for the first time since early June",
    "Daily RSI14 near 76 with price above the upper Bollinger band",
    "Alt product inflows down 73-96% in the week to 4 Sep while BTC absorbs the flow",
    "Own backtest: crypto sleeve -6.4%, Sharpe -0.15, 17% win rate",
    "Feed discrepancy: our mark is 12.764 against external quotes of $13.07-13.32 today"
  ],
  "invalidation": "Flips long again on a daily close above 14.00 - a clean new high made after this distribution, not into it - with exchange inflows from the tracked whale stopping. The bear case confirms on a daily close below 12.00, the base of the breakout, which would also put price back inside the pre-rally range; the trailing stop sits at 10.79.",
  "horizon_days": 21,
  "sources": [
    "https://coinmarketcap.com/top-stories/6a867cd9e9294340172a9f71/",
    "https://coinpedia.org/price-analysis/chainlink-price-analysis-can-link-hold-12-as-institutional-demand-rises/",
    "https://beincrypto.com/bitcoin-etf-inflows-altcoin-funds-slump/",
    "research/packets/2026-09-07.md (headlines: 'Bottomline Taps Chainlink to Bring 600 Banks On-Chain', PYMNTS, 4 Sep 2026; 'Chainlink whale sends $7.6m in LINK to Coinbase', Crypto News, 7 Sep 2026)",
    "research/backtests/2026-09-06.md",
    "https://www.cnbc.com/2026/08/31/markets-see-warsh-endorsing-a-rate-hike-in-september-not-everyone-is-convinced.html",
    "https://crypto.news/chainlink-whale-sends-7-6m-in-link-to-coinbase/",
    "https://coingape.com/chainlink-whales-dump-heavily-sparking-concerns-is-link-at-risk/",
    "https://blockonomi.com/chainlink-link-price-analyst-eyes-20-target-after-breakout-above-12",
    "https://finance.yahoo.com/news/why-crypto-market-down-today-035710630.html"
  ],
  "agent": "council/judge",
  "council_votes": {
    "bull": 0.7,
    "bear": 0.6,
    "macro": 0.35
  }
}
